{
  "schemaVersion": 1,
  "fixtureId": "integration-intelligence-tenant-isolation",
  "title": "W096 tenant-isolation variant — the full chain for two tenants side by side, zero cross-tenant leakage at every table the chain touches",
  "description": "The complete discover > recommend > approve > connect > verify > map > observe > request-scope > execute > reconcile > outcome chain runs for TWO fresh tenants (alpha and beta), each with its own directory source, discovered system, broker connection, grants and deep-action task. The final isolation-probe step then proves the tenant boundary at the application level (the W044 sweep doctrine): every chain table holds EXACTLY the per-tenant row counts (no row landed in, leaked into or duplicated by the other tenant), cross-tenant contract reads fail with each module's uniform not-found code, the other tenant's discovery source is refused as unauthorized BEFORE any transport interaction, and even an omnipotent-claims principal of one tenant stays blind to the other's records.",
  "chain": [
    "discover",
    "recommend",
    "approve",
    "connect",
    "verify",
    "map",
    "observe",
    "request-scope",
    "execute",
    "reconcile",
    "outcome"
  ],
  "variant": {
    "providerFailure": false,
    "deniedScope": false,
    "tenantIsolation": true
  },
  "tenants": [
    {
      "key": "alpha",
      "source": "fresh",
      "label": "tenant alpha — the full chain",
      "directorySource": {
        "provider": "notion",
        "displayName": "Northwind Tooling Directory",
        "providerAccountId": "ws-w096-iso-a",
        "authKind": "oauth"
      },
      "orgContext": {
        "goal": {
          "title": "Reduce customer churn",
          "objective": "Keep the customers we already have instead of constantly replacing them",
          "desiredState": "At-risk customers are identified and helped before they leave",
          "horizonEnd": "2027-03-31T00:00:00Z",
          "priority": "high",
          "successCriteria": "Quarterly churn below 3 percent",
          "ownerLabel": "Sarah (Head of Success)"
        },
        "unknown": {
          "question": "Which customers are at risk of leaving?",
          "consequence": "Without this we learn about churn only when the cancellation arrives"
        },
        "capability": {
          "name": "Customer success management",
          "description": "Proactively tracking and helping at-risk accounts"
        }
      },
      "directoryWindow": [
        {
          "externalId": "app-alpha-crm",
          "displayName": "Alpha CRM",
          "capabilityClasses": ["customer-records"]
        }
      ],
      "systems": {
        "crm": { "displayName": "Alpha CRM", "connectionKey": "iso-crm" }
      }
    },
    {
      "key": "beta",
      "source": "fresh",
      "label": "tenant beta — the full chain, side by side",
      "directorySource": {
        "provider": "notion",
        "displayName": "Southbay Tooling Directory",
        "providerAccountId": "ws-w096-iso-b",
        "authKind": "oauth"
      },
      "orgContext": {
        "goal": {
          "title": "Reduce customer churn",
          "objective": "Keep the customers we already have instead of constantly replacing them",
          "desiredState": "At-risk customers are identified and helped before they leave",
          "horizonEnd": "2027-03-31T00:00:00Z",
          "priority": "high",
          "successCriteria": "Quarterly churn below 3 percent",
          "ownerLabel": "Dana (Head of Success)"
        },
        "unknown": {
          "question": "Which customers are at risk of leaving?",
          "consequence": "Without this we learn about churn only when the cancellation arrives"
        },
        "capability": {
          "name": "Customer success management",
          "description": "Proactively tracking and helping at-risk accounts"
        }
      },
      "directoryWindow": [
        {
          "externalId": "app-beta-crm",
          "displayName": "Beta CRM",
          "capabilityClasses": ["customer-records"]
        }
      ],
      "systems": {
        "crm": { "displayName": "Beta CRM", "connectionKey": "iso-crm" }
      }
    }
  ],
  "actors": [
    {
      "key": "integration-admin-alpha",
      "tenant": "alpha",
      "authority": ["integration-intelligence:administer"]
    },
    { "key": "aurum-member-alpha", "tenant": "alpha", "authority": [] },
    { "key": "company-approver-alpha", "tenant": "alpha", "authority": ["actions:approve"] },
    {
      "key": "omnipotent-beta",
      "tenant": "beta",
      "authority": [
        "actions:approve",
        "actions:administer",
        "integration-intelligence:administer",
        "capability-grants:administer",
        "connection-broker:administer"
      ]
    },
    {
      "key": "integration-admin-beta",
      "tenant": "beta",
      "authority": ["integration-intelligence:administer"]
    },
    { "key": "aurum-member-beta", "tenant": "beta", "authority": [] },
    { "key": "company-approver-beta", "tenant": "beta", "authority": ["actions:approve"] }
  ],
  "broker": { "adapter": "embedded", "provider": "salesforce" },
  "verification": { "unreachableCapabilities": [] },
  "deepAction": {
    "taskContext": {
      "description": "Close out the Q1 renewals after the signed contracts landed",
      "requestedFor": "Q1 close"
    },
    "operations": [
      {
        "key": "file-crm",
        "system": "crm",
        "capabilityKey": "write.customer-records",
        "target": "cust-4042",
        "payload": { "stage": "onboarding-complete", "healthScore": 82 },
        "expectation": { "stage": "onboarding-complete", "healthScore": 82 }
      }
    ],
    "seededStates": [
      {
        "system": "crm",
        "target": "cust-4042",
        "state": { "stage": "onboarding", "healthScore": 55, "owner": "Ruth" }
      }
    ],
    "transientFailureTargets": [],
    "permanentRefusalTargets": [],
    "skipApplyTargets": []
  },
  "steps": [
    {
      "phase": "discover",
      "title": "the admin authorizes this tenant's directory source and Aurum surveys the authorized tooling",
      "invokes": [
        { "op": "create-org-context", "as": "integration-admin" },
        { "op": "register-directory-source", "as": "integration-admin" },
        { "op": "grant-discovery-source", "as": "integration-admin" },
        { "op": "run-discovery", "as": "aurum-member" }
      ],
      "expect": {
        "durable": [
          { "table": "integration_discovery_grants", "where": { "status": "active" }, "rows": 1 },
          { "table": "integration_systems", "rows": 1 },
          { "table": "integration_recommendations", "where": { "status": "proposed" }, "rows": 1 },
          { "table": "observations", "where": { "kind": "directory.system.discovered" }, "rows": 1 },
          { "table": "sources", "where": { "provider": "notion" }, "rows": 1 }
        ],
        "contract": [
          {
            "read": "list-systems",
            "as": "aurum-member",
            "assert": { "length": 1 }
          },
          {
            "read": "get-system",
            "system": "crm",
            "as": "aurum-member",
            "assert": {
              "connectionStatus": "discovered",
              "whyItMatters.basis": "org-context"
            }
          }
        ]
      }
    },
    {
      "phase": "recommend",
      "title": "the safe-by-default recommendation feed",
      "invokes": [{ "op": "list-recommendations", "as": "aurum-member" }],
      "expect": {
        "durable": [{ "table": "integration_recommendations", "rows": 1 }],
        "contract": [
          {
            "read": "list-recommendations",
            "as": "aurum-member",
            "assert": {
              "length": 1,
              "0.connectionMode": "read-only",
              "0.systemId": { "systemRef": "crm" }
            }
          }
        ]
      }
    },
    {
      "phase": "approve",
      "title": "the read-only connection is approved through the actions authority gate",
      "invokes": [
        { "op": "submit-recommendation-batch", "as": "aurum-member" },
        {
          "op": "decide-recommendation-batch",
          "as": "company-approver",
          "decision": "approve",
          "note": "read-only is fine"
        }
      ],
      "expect": {
        "durable": [
          { "table": "integration_recommendation_batches", "where": { "status": "approved" }, "rows": 1 },
          { "table": "integration_recommendations", "where": { "status": "approved" }, "rows": 1 },
          { "table": "action_requests", "where": { "action_kind": "integration-connection", "status": "approved" }, "rows": 1 },
          { "kind": "action-kind-decisions", "actionKind": "integration-connection", "decision": "approve", "rows": 1 }
        ]
      }
    },
    {
      "phase": "connect",
      "title": "the approved recommendation becomes a connected system and the broker issues the live connection",
      "invokes": [
        { "op": "connect-system", "system": "crm", "as": "aurum-member" },
        { "op": "initiate-broker-connection", "system": "crm", "as": "aurum-member" },
        { "op": "complete-broker-connection", "system": "crm", "as": "aurum-member" }
      ],
      "expect": {
        "durable": [
          { "table": "integration_recommendations", "where": { "status": "connected" }, "rows": 1 },
          { "table": "integration_verification_runs", "where": { "status": "verified" }, "rows": 1 },
          { "table": "broker_connections", "where": { "status": "connected" }, "rows": 1 },
          { "table": "broker_connection_events", "where": { "event": "connected" }, "rows": 1 }
        ],
        "contract": [
          {
            "read": "get-system",
            "system": "crm",
            "as": "aurum-member",
            "assert": { "connectionStatus": "connected", "health": "healthy" }
          }
        ]
      }
    },
    {